{
  "schemaVersion": "omk.run-manifest.v1",
  "runId": "proof-007-replay-inspect-20260531t080818z",
  "createdAt": "2026-05-31T08:08:18Z",
  "completedAt": "2026-05-31T08:08:18Z",
  "status": "passed",
  "providerPolicy": {
    "provider": "local",
    "mode": "pinned"
  },
  "nodes": [
    {
      "id": "collect-evidence",
      "label": "Replay inspect fixture",
      "status": "passed"
    }
  ],
  "artifacts": [
    {
      "path": "proof/verified-runs/007-replay-inspect/replay.json",
      "kind": "replay-output"
    },
    {
      "path": "proof/verified-runs/007-replay-inspect/inspect.json",
      "kind": "inspect-output"
    },
    {
      "path": "proof/verified-runs/007-replay-inspect/run-fixture/run.json",
      "kind": "fixture"
    },
    {
      "path": "proof/verified-runs/007-replay-inspect/run-fixture/attempts.jsonl",
      "kind": "fixture"
    }
  ],
  "evidenceSummary": {
    "required": 2,
    "passed": 2,
    "failed": 0,
    "missing": 0
  },
  "decisionTracePath": "proof/verified-runs/007-replay-inspect/decisions.jsonl"
}
