{
  "schemaVersion": "omk.run-manifest.v1",
  "runId": "proof-006-evidence-block-20260531t080818z",
  "createdAt": "2026-05-31T08:08:18Z",
  "completedAt": "2026-05-31T08:08:18Z",
  "status": "blocked",
  "providerPolicy": {
    "provider": "local",
    "mode": "pinned"
  },
  "nodes": [
    {
      "id": "required-artifact",
      "label": "Required artifact gate",
      "status": "blocked"
    }
  ],
  "artifacts": [
    {
      "path": "proof/verified-runs/006-evidence-block/omk-verify.json",
      "kind": "verify-output"
    },
    {
      "path": "proof/verified-runs/006-evidence-block/omk-verify.stderr",
      "kind": "stderr"
    },
    {
      "path": "proof/verified-runs/006-evidence-block/state.json",
      "kind": "run-state"
    }
  ],
  "evidenceSummary": {
    "required": 2,
    "passed": 1,
    "failed": 0,
    "missing": 1
  },
  "decisionTracePath": "proof/verified-runs/006-evidence-block/decisions.jsonl"
}
