{
  "schemaVersion": "omk.run-manifest.v1",
  "runId": "proof-009-no-kimi-smoke-20260531t090138424z",
  "createdAt": "2026-05-31T09:01:38.425Z",
  "completedAt": "2026-05-31T09:01:57.356Z",
  "status": "passed",
  "providerPolicy": {
    "provider": "provider-neutral",
    "mode": "auto"
  },
  "nodes": [
    {
      "nodeId": "verify-no-kimi",
      "label": "Run verify:no-kimi",
      "status": "passed",
      "provider": "auto"
    },
    {
      "nodeId": "provider-neutral-runtime",
      "label": "Check no-Kimi runtime path",
      "status": "passed",
      "provider": "codex"
    }
  ],
  "artifacts": [
    {
      "kind": "stdout",
      "path": "proof/verified-runs/009-no-kimi-smoke/verify-no-kimi.out",
      "sha256": "2f236b672edbbdaaa05888a181bbb9601fdd4b971d474004d6e98f094dbb3bb7"
    },
    {
      "kind": "stderr",
      "path": "proof/verified-runs/009-no-kimi-smoke/verify-no-kimi.stderr",
      "sha256": "01ba4719c80b6fe911b091a7c05124b64eeece964e09c058ef8f9805daca546b"
    }
  ],
  "evidenceSummary": {
    "required": 2,
    "passed": 2,
    "failed": 0,
    "missing": 0
  },
  "decisionTracePath": "proof/verified-runs/009-no-kimi-smoke/decisions.jsonl"
}
