{
  "schemaVersion": "omk.run-manifest.v1",
  "runId": "proof-010-fallback-routing-20260531t090157359z",
  "createdAt": "2026-05-31T09:01:57.360Z",
  "completedAt": "2026-05-31T09:01:57.618Z",
  "status": "passed",
  "providerPolicy": {
    "provider": "deepseek",
    "mode": "fallback"
  },
  "nodes": [
    {
      "nodeId": "fallback-routing-test",
      "label": "Run targeted provider fallback test",
      "status": "passed",
      "provider": "node-test"
    },
    {
      "nodeId": "fallback-routing-metadata",
      "label": "Verify provider fallback metadata",
      "status": "passed",
      "provider": "deepseek-to-kimi"
    }
  ],
  "artifacts": [
    {
      "kind": "stdout",
      "path": "proof/verified-runs/010-fallback-routing/fallback-routing-test.out",
      "sha256": "f8c0c7dcedc3b3772ff930445dd16fbb7bd04784137370f4e5206203d9590ad2"
    },
    {
      "kind": "stderr",
      "path": "proof/verified-runs/010-fallback-routing/fallback-routing-test.stderr",
      "sha256": "01ba4719c80b6fe911b091a7c05124b64eeece964e09c058ef8f9805daca546b"
    }
  ],
  "evidenceSummary": {
    "required": 2,
    "passed": 2,
    "failed": 0,
    "missing": 0
  },
  "decisionTracePath": "proof/verified-runs/010-fallback-routing/decisions.jsonl"
}
